時刻,コード,会社名,会社名_en,表題,表題_en,市場,市場_en,PDF
15:30,36730,ブロドリーフ,Brodleaf,譲渡制限付株式報酬としての自己株式の処分に関するお知らせ,Notice regarding disposal of treasury stock as restricted stock compensation,東,TSE,https://www.release.tdnet.info/inbs/140120260415504468.pdf
15:30,35650,アセンテック,Ascentec,支配株主等に関する事項について,Matters Regarding Controlling Shareholders,東,TSE,https://www.release.tdnet.info/inbs/140120260414504083.pdf
15:30,35430,コメダ,Komeda,剰余金の配当に関するお知らせ,Notice Regarding Dividend,東名,TSE / NSE,https://www.release.tdnet.info/inbs/140120260415504604.pdf
15:30,34490,テクノフレックス,technoflex,業績予想の修正に関するお知らせ,Notice Regarding Revision of Earnings Forecast,東,TSE,https://www.release.tdnet.info/inbs/140120260414503891.pdf
15:30,339A0,Ｇ－プログレス,G-Progress,2026年2月期 決算説明会 プレゼンテーションスクリプト,Earnings Presentation Materials for FY2026 ending February,東,TSE,https://www.release.tdnet.info/inbs/140120260415504454.pdf
15:30,33910,ツルハＨＤ,Tsuruha HD,（開示事項の経過）イオン株式会社による当社株式に対する公開買付け後の株式取得の完了に関するお知らせ,"(Progress Disclosure) Notice Regarding Completion of Acquisition of Company Shares by Aeon Co., Ltd. after Tender Offer",東,TSE,https://www.release.tdnet.info/inbs/140120260415504841.pdf
15:30,338A0,Ｇ－Ｚｅｎｍｕ,G-Zenmu,譲渡制限付株式報酬としての新株式発行に関するお知らせ,Notice regarding issuance of new shares as restricted stock compensation,東,TSE,https://www.release.tdnet.info/inbs/140120260415504683.pdf
15:30,32520,地主,landowner,譲渡制限付株式報酬としての自己株式の処分の払込完了に関するお知らせ,Notice Regarding Completion of Payment for Disposal of Treasury Shares as Restricted Stock Compensation,東,TSE,https://www.release.tdnet.info/inbs/140120260415504561.pdf
15:30,31860,ネクステージ,Nextage,会社分割（簡易吸収分割）に関するお知らせ,Notice regarding company split (simple absorption-type split),東名,TSE / NSE,https://www.release.tdnet.info/inbs/140120260410502077.pdf
15:30,31350,マーケットエンター,market enter,月次連結売上高（速報）,Monthly consolidated sales (preliminary report),東,TSE,https://www.release.tdnet.info/inbs/140120260415504375.pdf
15:30,30910,ブロンコＢ,Bronco B,譲渡制限付株式報酬としての自己株式の処分に関するお知らせ,Notice regarding disposal of treasury stock as restricted stock compensation,東名,TSE / NSE,https://www.release.tdnet.info/inbs/140120260415504445.pdf
15:30,30910,ブロンコＢ,Bronco B,組織変更及び人事異動に関するお知らせ,Notice regarding organizational changes and personnel changes,東名,TSE / NSE,https://www.release.tdnet.info/inbs/140120260415504444.pdf
15:30,30860,Ｊフロント,J front,２０２６年３月度　Ｊ．フロントリテイリング　連結売上収益報告（ＩＦＲＳ）,Sales Report for March 2026,東名,TSE / NSE,https://www.release.tdnet.info/inbs/140120260415504778.pdf
15:30,29780,Ｇ－ツクルバ,G-Tsukuruba,第三者割当による新株式発行に係る払込完了に関するお知らせ,Notice regarding completion of payment for issuance of new shares through third-party allotment,東,TSE,https://www.release.tdnet.info/inbs/140120260415504829.pdf
15:30,29270,ＡＦＣ－ＨＤ,AFC-HD,（開示内容の変更）連結子会社株式会社さいか屋の資本金および資本準備金の額の減少等の効力発生日の変更に関するお知らせ,"(Changes in disclosure content) Notice regarding changes in the effective date of reductions in capital and capital reserves of consolidated subsidiary Saikaya Co., Ltd.",東,TSE,https://www.release.tdnet.info/inbs/140120260414503419.pdf
15:30,291A0,Ｇ－リスキル,G-Reskill,監査等委員会設置会社への移行、定款の一部変更及び役員の異動に関するお知らせ,"Notice regarding transition to a company with an audit and supervisory committee, partial changes to the articles of incorporation, and changes in officers",東,TSE,https://www.release.tdnet.info/inbs/140120260414504382.pdf
15:30,26980,キャンドゥ,cando,(訂正・数値データ訂正)「2026年２月期　決算短信〔日本基準〕(連結)」の一部訂正について,(Correction) Earnings Report (Consolidated) for FY2026 ending February,東,TSE,https://www.release.tdnet.info/inbs/140120260415504510.pdf
15:30,26560,ベクターＨＤ,vector hd,当社に対する訴訟の一部取下げに関するお知らせ,Notice regarding partial withdrawal of lawsuit against our company,東,TSE,https://www.release.tdnet.info/inbs/140120260415504704.pdf
08:00,560A0,Ｐ－オカダコーポ,P-Okada Corpo,流動性プロバイダーの指定のお知らせ,Notice Regarding Designation of Liquidity Provider,東,TSE,https://www.release.tdnet.info/inbs/140120260414503974.pdf
08:00,560A0,Ｐ－オカダコーポ,P-Okada Corpo,東京証券取引所TOKYO PRO Marketへの上場に伴う当社決算情報等のお知らせ,Listing on Tokyo Stock Exchange TOKYO PRO Market,東,TSE,https://www.release.tdnet.info/inbs/140120260414503971.pdf
08:00,560A0,Ｐ－オカダコーポ,P-Okada Corpo,東京証券取引所TOKYO PRO Marketへの上場のお知らせ,Listing on Tokyo Stock Exchange TOKYO PRO Market,東,TSE,https://www.release.tdnet.info/inbs/140120260414503969.pdf
08:30,89190,カチタス,Katitas,住宅設備受注停止の報道に係る当社業績への影響について,Regarding the impact on the Company's business results due to reports of suspension of orders for housing equipment,東,TSE,https://www.release.tdnet.info/inbs/140120260414504403.pdf
08:30,16724,Ｅ－ＷｉｓｄｏｍＴｒ,E-WisdomTr,上場ETF（管理会社：WisdomTree、外国投資法人：CSL）に関する日々の開示事項,Daily Disclosure Items Regarding Listed ETF,東,TSE,https://www.release.tdnet.info/inbs/140120260415504379.pdf
08:30,16724,Ｅ－ＷｉｓｄｏｍＴｒ,E-WisdomTr,上場ETF（管理会社：WisdomTree、外国投資法人：MSL）に関する日々の開示事項,Daily Disclosure Items Regarding Listed ETF,東,TSE,https://www.release.tdnet.info/inbs/140120260415504378.pdf
09:00,48810,Ｇ－ファンペップ,G-Fan Pep,第13回新株予約権（行使価額修正条項付）の大量行使に関するお知らせ,Notice Regarding Stock Acquisition Rights,東,TSE,https://www.release.tdnet.info/inbs/140120260415504423.pdf
09:00,153A0,Ｇ－カウリス,G-Caulis,自己株式の取得状況に関するお知らせ,Notice Regarding Status of Share Buyback,東,TSE,https://www.release.tdnet.info/inbs/140120260415504449.pdf
09:30,38230,ＷＨＹ　ＨＯＷ　ＤＯ,WHY HOW DO,第22期（2026年４月期）半期報告書の提出完了に関するお知らせ,Notice regarding completion of submission of semi-annual report for the 22nd period (ending April 2026),東,TSE,https://www.release.tdnet.info/inbs/140120260414504327.pdf
09:30,18820,東亜道,Toa Road,株主代表訴訟の和解に関するお知らせ,Notice regarding settlement of shareholder derivative lawsuit,東,TSE,https://www.release.tdnet.info/inbs/140120260413502990.pdf
09:35,13294,Ｅ－ブラックロック,E-Blackrock,上場ETF（管理会社：ブラックロック・ジャパン）に関する日々の開示事項,Daily Disclosure Items Regarding Listed ETF,東,TSE,https://www.release.tdnet.info/inbs/140120260415504430.pdf
10:00,70590,コプロＨＤ,Copro HD,2026年3月度 在籍技術者数、稼働技術者数・稼働率の月次開示に関するお知らせ,Monthly Report for March 2026,東名,TSE / NSE,https://www.release.tdnet.info/inbs/140120260414504163.pdf
10:00,49200,日本色材,japan color material,自己株式立会外買付取引（ToSTNeT-3）による自己株式取得結果及び自己株式取得終了に関するお知らせ,Announcement regarding the results and completion of own stock repurchase through off-auction own stock repurchase transaction (ToSTNeT-3),東名,TSE / NSE,https://www.release.tdnet.info/inbs/140120260415504441.pdf
10:00,35470,ユニシアＨＤ,Unisia HD,2026年11月期　第1四半期決算補足説明資料,Supplementary Earnings Materials for FY2026 ending November,東,TSE,https://www.release.tdnet.info/inbs/140120260414504368.pdf
