時刻,コード,会社名,会社名_en,表題,表題_en,市場,市場_en,PDF
15:30,25900,ＤｙＤｏ,DyDo,譲渡制限付株式報酬としての自己株式の処分に関するお知らせ,Notice regarding disposal of treasury stock as restricted stock compensation,東,TSE,https://www.release.tdnet.info/inbs/140120260415504498.pdf
15:30,25900,ＤｙＤｏ,DyDo,当社株式の大規模買付行為への対応策（買収への対応方針）の継続承認および独立委員会の委員選任に関するお知らせ,Notice regarding continued approval of countermeasures against large-scale purchases of our company's shares (policy for responding to acquisitions) and appointment of members of the independent committee,東,TSE,https://www.release.tdnet.info/inbs/140120260415504432.pdf
15:30,23340,Ｇ－イオレ,G-Iole,募集新株予約権（有償ストック・オプション）の発行内容確定に関するお知らせ,Notice Regarding Stock Acquisition Rights,東,TSE,https://www.release.tdnet.info/inbs/140120260415504606.pdf
15:30,22060,グリコ,Glico,連結子会社からの配当金受領に関するお知らせ,Notice regarding receipt of dividends from consolidated subsidiaries,東,TSE,https://www.release.tdnet.info/inbs/140120260408500141.pdf
15:30,22060,グリコ,Glico,自己株式の取得状況に関するお知らせ,Notice Regarding Status of Share Buyback,東,TSE,https://www.release.tdnet.info/inbs/140120260402597187.pdf
15:30,21270,日本Ｍ＆Ａ,Japan M&A,連結子会社の役員の異動等に関するお知らせ,Notice regarding changes in officers of consolidated subsidiaries,東,TSE,https://www.release.tdnet.info/inbs/140120260415504751.pdf
15:30,15140,住石ＨＤ,Sumishi HD,業績予想及び配当予想の修正に関するお知らせ,Notice regarding revisions to performance forecasts and dividend forecasts,東,TSE,https://www.release.tdnet.info/inbs/140120260327591550.pdf
15:30,148A0,Ｇ－ハッチ・ワーク,G-hatch work,有償ストック・オプション（新株予約権）の発行に関するお知らせ,Notice Regarding Stock Acquisition Rights,東,TSE,https://www.release.tdnet.info/inbs/140120260415504739.pdf
15:33,40140,Ｇ－カラダノート,G-Body Note,株式会社FPOのグループ化に伴うシナジーについてご説明補足資料,"Supplementary materials explaining the synergies associated with the grouping of FPO Co., Ltd.",東,TSE,https://www.release.tdnet.info/inbs/140120260415504873.pdf
15:33,40140,Ｇ－カラダノート,G-Body Note,（開示事項の経過）株式会社FPOの株式取得（子会社化）の実行決定及び和解による訴訟終了に関するお知らせ,"(Progress Disclosure) Notice regarding decision to acquire shares of FPO Co., Ltd. (making it a subsidiary) and termination of litigation through settlement",東,TSE,https://www.release.tdnet.info/inbs/140120260415504768.pdf
15:50,31950,Ｇ－ジェネパ,G-Genepa,2026年３月度月次売上高前年同月比についてのお知らせ,Monthly Report for March 2026,東,TSE,https://www.release.tdnet.info/inbs/140120260415504860.pdf
16:00,91450,ビーイングＨＤ,Being HD,当社グループ月次連結営業収益に関するお知らせ（2026年３月度　速報版）,Notice regarding our group's monthly consolidated operating revenue (March 2026 preliminary version),東,TSE,https://www.release.tdnet.info/inbs/140120260415504474.pdf
16:00,79840,コクヨ,Kokuyo,譲渡制限付株式報酬としての自己株式の処分の払込完了に関するお知らせ,Notice Regarding Completion of Payment for Disposal of Treasury Shares as Restricted Stock Compensation,東,TSE,https://www.release.tdnet.info/inbs/140120260415504492.pdf
16:00,77250,インターアクション,interaction,2026年5月期第3四半期決算説明会 質疑応答（要旨),Earnings Presentation Materials for FY2026 ending May,東,TSE,https://www.release.tdnet.info/inbs/140120260415504482.pdf
16:00,77250,インターアクション,interaction,2026年5月期第3四半期決算説明会資料 （スピーチ原稿）,Earnings Presentation Materials for FY2026 ending May,東,TSE,https://www.release.tdnet.info/inbs/140120260415504488.pdf
16:00,76780,あさくま,Asakuma,株式分割及び株式優待制度の実質的拡充に関するお知らせ,Notice regarding stock split and substantial expansion of stock benefit system,東,TSE,https://www.release.tdnet.info/inbs/140120260414503359.pdf
16:00,76240,ＮａＩＴＯ,NaITO,役員の異動に関するお知らせ,Notice Regarding Change of Officers,東,TSE,https://www.release.tdnet.info/inbs/140120260415504816.pdf
16:00,73430,Ｇ－ブロードマインド,G-Broadmind,通期連結業績予想の修正及び配当予想の修正（増配）に関するお知らせ,Notice regarding revisions to full-year consolidated performance forecasts and dividend forecasts (dividend increase),東,TSE,https://www.release.tdnet.info/inbs/140120260413502685.pdf
16:00,71360,Ｐ－ウェルビンＧ,P-Welvin G,グループ内組織再編（吸収分割・新設分割）に関するお知らせ,Notice regarding intra-group reorganization (absorption-type company split/incorporation-type company split),東,TSE,https://www.release.tdnet.info/inbs/140120260414504286.pdf
16:00,71360,Ｐ－ウェルビンＧ,P-Welvin G,TOKYO PRO Market における当社株式の上場廃止申請に関するお知らせ,Notice regarding application for delisting of our shares from TOKYO PRO Market,東,TSE,https://www.release.tdnet.info/inbs/140120260414504284.pdf
16:00,70930,Ｇ－アディッシュ,G-Adish,譲渡制限付株式報酬としての自己株式の処分に関するお知らせ,Notice regarding disposal of treasury stock as restricted stock compensation,東,TSE,https://www.release.tdnet.info/inbs/140120260414504381.pdf
16:00,70430,Ｇ－アルー,G-Alu,2026年３月度　etudes月次KPI（速報）のお知らせ,Monthly Report for March 2026,東,TSE,https://www.release.tdnet.info/inbs/140120260414503309.pdf
16:00,65610,Ｇ－ＨＡＮＡＴＯＵＲ,G-HANATOUR,九州営業所移転に関するお知らせ,Notice regarding relocation of Kyushu office,東,TSE,https://www.release.tdnet.info/inbs/140120260414504244.pdf
16:00,58340,Ｇ－ＳＢＩリーシング,G-SBI Leasing,オペレーティング・リース事業ファンドへの立替出資のお知らせ,Notice of advance investment in operating lease business fund,東,TSE,https://www.release.tdnet.info/inbs/140120260414503771.pdf
16:00,50790,ノバック,Novak,役員の異動に関するお知らせ,Notice Regarding Change of Officers,東,TSE,https://www.release.tdnet.info/inbs/140120260415504505.pdf
16:00,48840,Ｇ－クリングル,G-Kringle,米国子会社への増資に関するお知らせ,Notice regarding capital increase in US subsidiary,東,TSE,https://www.release.tdnet.info/inbs/140120260415504707.pdf
16:00,46660,パーク２４,park 24,2026年10月期　速報数値　3月度,Preliminary figures for October 2026 March,東,TSE,https://www.release.tdnet.info/inbs/140120260415504793.pdf
16:00,431A0,Ｇ－ユーソナー,G-Usonar,従業員持株会に対する譲渡制限付株式としての自己株式処分に関するお知らせ,Notice regarding disposal of treasury stock as restricted stock to employee stock ownership association,東,TSE,https://www.release.tdnet.info/inbs/140120260414504339.pdf
16:00,431A0,Ｇ－ユーソナー,G-Usonar,譲渡制限付株式としての自己株式の処分に関するお知らせ,Notice regarding disposal of treasury stock as restricted stock,東,TSE,https://www.release.tdnet.info/inbs/140120260414504338.pdf
16:00,39790,Ｇ－うるる,G-Ururu,2026年3月 月次IRレポート (NJSS月次情報含む),Monthly Report for March 2026,東,TSE,https://www.release.tdnet.info/inbs/140120260415504552.pdf
16:00,36780,メディアドゥ,media do,2026年2月期 通期決算説明資料,Earnings Presentation Materials for FY2026 ending February,東,TSE,https://www.release.tdnet.info/inbs/140120260414504370.pdf
16:00,36480,ＡＧＳ,AGS,役員人事内定に関するお知らせ,Notice regarding appointment of officers,東,TSE,https://www.release.tdnet.info/inbs/140120260415504661.pdf
16:00,36480,ＡＧＳ,AGS,配当予想の修正（増配）に関するお知らせ,Notice regarding revision of dividend forecast (dividend increase),東,TSE,https://www.release.tdnet.info/inbs/140120260415504636.pdf
16:00,36480,ＡＧＳ,AGS,子会社の吸収合併（簡易合併・略式合併）に関するお知らせ,Notice Regarding Absorption Merger of Subsidiary (Simplified/Summary Merger),東,TSE,https://www.release.tdnet.info/inbs/140120260415504633.pdf
16:00,33060,日製麻,Japanese hemp,持株会社体制への移行に伴う分割準備会社設立に関するお知らせ,Notice regarding establishment of split preparation company due to transition to holding company structure,東,TSE,https://www.release.tdnet.info/inbs/140120260415504909.pdf
16:00,31210,マーチャント,merchant,外部協力者に対する第三者割当による自己株式の処分の中止に関するお知らせ,Notice regarding discontinuation of disposal of treasury stock through third-party allotment to external collaborators,東,TSE,https://www.release.tdnet.info/inbs/140120260415504774.pdf
16:00,28840,ヨシムラ・Ｆ・ＨＤ,Yoshimura F. HD,株主優待制度の拡充に関するお知らせ,Notice regarding expansion of shareholder benefit system,東,TSE,https://www.release.tdnet.info/inbs/140120260415504514.pdf
16:00,28840,ヨシムラ・Ｆ・ＨＤ,Yoshimura F. HD,通期連結業績予想値と実績値の差異に関するお知らせ,Notice regarding the difference between the full-year consolidated performance forecast and actual results,東,TSE,https://www.release.tdnet.info/inbs/140120260415504513.pdf
16:00,28840,ヨシムラ・Ｆ・ＨＤ,Yoshimura F. HD,2026年２月期決算説明及び中期経営計画,Earnings Presentation Materials for FY2026 ending February,東,TSE,https://www.release.tdnet.info/inbs/140120260415504509.pdf
16:00,28840,ヨシムラ・Ｆ・ＨＤ,Yoshimura F. HD,2026年２月期 決算短信〔日本基準〕（連結）,Earnings Report (Consolidated) for FY2026 ending February,東,TSE,https://www.release.tdnet.info/inbs/140120260415504508.pdf
16:00,27510,テンポスＨＤ,Tempos HD,株式会社テンポスホールディングスによる株式会社明和製作所の完全子会社化に関する株式交換（簡易株式交換）のお知らせ,"Notice of stock exchange (simple stock exchange) regarding Meiwa Seisakusho Co., Ltd. becoming a wholly owned subsidiary of Tempos Holdings Co., Ltd.",東,TSE,https://www.release.tdnet.info/inbs/140120260415504501.pdf
16:00,21340,キタハマキャピタル,Kitahama Capital,第三者割当による第15回新株予約権の発行及び第三者割当契約締結に関するお知らせ,Notice Regarding Stock Acquisition Rights,東,TSE,https://www.release.tdnet.info/inbs/140120260415504728.pdf
16:00,207A0,Ｐ－ライジング,P-Rising,（開示事項の経過）固定資産取得に伴う資金の借入 （コミットメント期間付きタームローン契約）に関するお知らせ,(Progress Disclosure) Notice regarding borrowing of funds for fixed asset acquisition (term loan agreement with commitment period),東,TSE,https://www.release.tdnet.info/inbs/140120260415504567.pdf
16:00,17830,ｆａｎｔａｓｉｓｔａ,fantasista,第9回新株予約権の一部譲渡承認に関するお知らせ（ABCキャピタル投資事業有限責任組合に対する譲渡）,Notice Regarding Stock Acquisition Rights,東,TSE,https://www.release.tdnet.info/inbs/140120260415504770.pdf
16:00,17830,ｆａｎｔａｓｉｓｔａ,fantasista,第9回新株予約権の一部譲渡承認に関するお知らせ（Green Partners 有限責任事業組合に対する譲渡）,Notice Regarding Stock Acquisition Rights,東,TSE,https://www.release.tdnet.info/inbs/140120260415504710.pdf
16:03,334A0,Ｇ－ＶＰＪ,G-VPJ,株式分割および株式分割に伴う定款の一部変更に関するお知らせ,Notice Regarding Share Split and Partial Amendment to Articles of Incorporation,東,TSE,https://www.release.tdnet.info/inbs/140120260415504380.pdf
16:20,79850,ネポン,Nepon,東京証券取引所における当社株式の上場廃止の決定及び整理銘柄の指定に関するお知らせ,Notice regarding the decision to delist the Company's shares from the Tokyo Stock Exchange and the designation of stocks for delisting,東福,TSE / FSE,https://www.release.tdnet.info/inbs/140120260415504970.pdf
16:30,94330,ＫＤＤＩ,KDDI,連結子会社の増資（特定子会社化）に関するお知らせ,Notice regarding capital increase of consolidated subsidiary (becoming a specified subsidiary),東,TSE,https://www.release.tdnet.info/inbs/140120260415504805.pdf
16:30,90200,ＪＲ東,JR East,JR東日本不動産株式会社と伊藤忠都市開発株式会社の吸収合併に関するお知らせ,"Notice regarding absorption-type merger between JR East Real Estate Co., Ltd. and ITOCHU Urban Development Co., Ltd.",東,TSE,https://www.release.tdnet.info/inbs/140120260414504366.pdf
16:30,81050,ＢｉｔｃｏｉｎＪＰＮ,BitcoinJPN,上場維持基準への適合及び当社株式の監理銘柄(確認中)指定解除に関するお知らせ,Notice regarding compliance with listing maintenance standards and cancellation of designation of stock under supervision (currently being confirmed) for our stock,東,TSE,https://www.release.tdnet.info/inbs/140120260415504619.pdf
16:30,80010,伊藤忠,Itochu,JR東日本不動産株式会社と伊藤忠都市開発株式会社の吸収合併に関するお知らせ,"Notice regarding absorption-type merger between JR East Real Estate Co., Ltd. and ITOCHU Urban Development Co., Ltd.",東,TSE,https://www.release.tdnet.info/inbs/140120260415504716.pdf
16:30,79010,マツモト,matsumoto,主要株主及び主要株主である筆頭株主の異動（予定）及び公開買付けに準ずる行為として政令で定める買集め行為に関するお知らせ,"Notice regarding the (planned) change in the major shareholder and the largest shareholder who is the major shareholder, and the acquisition act specified by government ordinance as an act equivalent to a tender offer.",東,TSE,https://www.release.tdnet.info/inbs/140120260415504742.pdf
16:30,71850,ヒロセ通商,Hirose Tsusho,2026年３月度　月次概況（速報）に関するお知らせ,Monthly Report for March 2026,東,TSE,https://www.release.tdnet.info/inbs/140120260414503260.pdf
16:30,65480,Ｇ－旅工房,G-Tabi Kobo,内部管理体制の強化に関するお知らせ,Notice regarding strengthening of internal control system,東,TSE,https://www.release.tdnet.info/inbs/140120260415504832.pdf
16:30,65480,Ｇ－旅工房,G-Tabi Kobo,「改善計画・状況報告書」の公表に関するお知らせ,Notice regarding publication of “Improvement Plan/Status Report”,東,TSE,https://www.release.tdnet.info/inbs/140120260415504687.pdf
16:30,61770,Ｇ－ＡｐｐＢａｎｋ,G-AppBank,有償ストックオプション（第16回新株予約権）の発行に関するお知らせ,Notice Regarding Stock Acquisition Rights,東,TSE,https://www.release.tdnet.info/inbs/140120260415504958.pdf
16:30,61420,富士精工,Fuji Seiko,自己株式立会外買付取引（Ｎ－ＮＥＴ３）による自己株式の取得結果及び自己株式取得終了ならびに自己株式の消却に関するお知らせ,"Announcement regarding the results of acquisition of treasury stock through off-auction treasury stock repurchase transaction (N-NET3), completion of treasury stock acquisition, and cancellation of treasury stock",名,NSE,https://www.release.tdnet.info/inbs/140120260415504422.pdf
16:30,45650,ネクセラファーマ,Nextera Pharma,J-ESOP導入による新株式発行、RSU制度に基づく新株式発行および過年度のRSU制度に基づく新株式発行の発行価額等の決定に関するお知らせ,"Announcement regarding the issuance of new shares due to the introduction of J-ESOP, the issuance of new shares based on the RSU system, and the determination of the issue price, etc. of the issuance of new shares based on the RSU system of previous years",東,TSE,https://www.release.tdnet.info/inbs/140120260415504721.pdf
16:30,31530,八洲電機,Yasu Electric,自己株式の取得及び自己株式立会外買付取引(ToSTNeT-3)による自己株式の買付けに関するお知らせ,Notice regarding acquisition of treasury stock and purchase of treasury stock through off-auction treasury stock repurchase transaction (ToSTNeT-3),東,TSE,https://www.release.tdnet.info/inbs/140120260414504359.pdf
16:30,31530,八洲電機,Yasu Electric,取締役候補者選任のお知らせ,Notice of appointment of director candidates,東,TSE,https://www.release.tdnet.info/inbs/140120260414504357.pdf
16:40,48400,トライアイズ,try eyes,中長期成長戦略「TRIiS2.0」発表のお知らせ,Announcement of medium- to long-term growth strategy “TRIiS2.0”,東,TSE,https://www.release.tdnet.info/inbs/140120260415504967.pdf
16:45,63960,宇野沢鉄,Unozawa Iron,上場維持基準への適合及び当社株式の監理銘柄(確認中)指定解除に関するお知らせ,Notice regarding compliance with listing maintenance standards and cancellation of designation of stock under supervision (currently being confirmed) for our stock,東名,TSE / NSE,https://www.release.tdnet.info/inbs/140120260415504972.pdf
16:45,46190,日特塗料,Nittoku paint,社外取締役候補者の選任及び退任役員に関するお知らせ,Notice regarding election of outside director candidates and retiring officers,東,TSE,https://www.release.tdnet.info/inbs/140120260415504534.pdf
16:50,86040,野村,Nomura,自己株式の取得結果および取得終了に関するお知らせ,Notice regarding the results and completion of acquisition of treasury stock,東名,TSE / NSE,https://www.release.tdnet.info/inbs/140120260415504943.pdf
16:50,76020,レダックス,redux,上場維持基準への適合及び当社株式の監理銘柄（確認中）指定解除に関するお知らせ,Notice regarding compliance with listing maintenance standards and cancellation of designation of stock under supervision (currently being confirmed) for our stock,東,TSE,https://www.release.tdnet.info/inbs/140120260415504719.pdf
17:00,92490,日本エコシステム,Japan ecosystem,札幌証券取引所本則市場への重複上場承認に関するお知らせ,Notice Regarding Approval of Dual Listing on the Sapporo Stock Exchange Main Market,東名,TSE / NSE,https://www.release.tdnet.info/inbs/140120260415504759.pdf
17:00,79460,光陽社,Koyosha,東京証券取引所における当社株式の上場廃止の決定及び整理銘柄の指定に関するお知らせ,Notice regarding the decision to delist the Company's shares from the Tokyo Stock Exchange and the designation of stocks for delisting,東名,TSE / NSE,https://www.release.tdnet.info/inbs/140120260415504979.pdf
17:00,73450,Ｇ－アイパートナーズ,G-I Partners,重要な経営指標の推移に関するお知らせ,Notice regarding trends in important management indicators,東,TSE,https://www.release.tdnet.info/inbs/140120260414503495.pdf
17:00,70590,コプロＨＤ,Copro HD,(訂正)2026 年 3 月度 在籍技術者数、稼働技術者数・稼働率の月次開示に関するお知らせ,"(Correction) March 2026 Notice regarding monthly disclosure of number of registered engineers, number of working engineers, and operation rate",東名,TSE / NSE,https://www.release.tdnet.info/inbs/140120260415504971.pdf
17:00,58560,エルアイイーエイチ,LIIEEH,臨時株主総会付議議案の決定および定款一部変更に関するお知らせ,Notice regarding decisions to be made at the extraordinary general meeting of shareholders and partial amendments to the articles of incorporation,東,TSE,https://www.release.tdnet.info/inbs/140120260415504884.pdf
17:00,527A0,Ｐ－ＮＯＳＥＳＨＯＰ,P-NOSESHOP,臨時株主総会招集のための基準日設定及び臨時株主総会の開催並びに付議議案の決定に関するお知らせ,"Notice regarding the setting of the record date for convening an extraordinary general meeting of shareholders, the holding of an extraordinary general meeting of shareholders, and the determination of proposals to be submitted",東,TSE,https://www.release.tdnet.info/inbs/140120260415504542.pdf
17:00,48920,Ｇ－サイフューズ,G-Cyfuse,新株予約権の取得及び消却並びに資金使途の変更に関する決定のお知らせ,Notice of decision regarding acquisition and cancellation of stock acquisition rights and change in use of funds,東福,TSE / FSE,https://www.release.tdnet.info/inbs/140120260415504670.pdf
17:00,47550,楽天グループ,rakuten group,当社の取締役で当社執行役員を兼務する者に対する退職時報酬型ストックオプション（新株予約権）の付与について,Regarding the granting of stock options (stock acquisition rights) as compensation at the time of retirement to directors of the Company who also serve as executive officers of the Company,東,TSE,https://www.release.tdnet.info/inbs/140120260415504667.pdf
17:00,47550,楽天グループ,rakuten group,当社取締役及び当社子会社従業員に対するストックオプション（新株予約権）の付与について,Regarding the granting of stock options (stock acquisition rights) to directors of the Company and employees of the Company's subsidiaries,東,TSE,https://www.release.tdnet.info/inbs/140120260415504664.pdf
17:00,44450,Ｇ－リビンＴ,G-Livin T,株式分割、株式分割に伴う定款の一部変更、自己株式取得に係る事項の一部変更および株主優待制度の変更に関するお知らせ,"Notice regarding stock split, partial changes to the articles of incorporation due to the stock split, partial changes to matters related to the acquisition of own shares, and changes to the shareholder benefit system",東名,TSE / NSE,https://www.release.tdnet.info/inbs/140120260415504821.pdf
17:00,43100,ＤＩ,DI,剰余金の配当に関するお知らせ,Notice Regarding Dividend,東,TSE,https://www.release.tdnet.info/inbs/140120260326590107.pdf
17:00,34830,Ｐ－翔栄,P-Shoei,（開示事項の経過）販売用不動産の取得完了及び資金の借入に関するお知らせ,(Progress Disclosure) Notice regarding completion of acquisition of real estate for sale and borrowing of funds,東,TSE,https://www.release.tdnet.info/inbs/140120260414504237.pdf
17:00,33260,ランシステム,run system,上場維持基準への適合及び当社株式の監理銘柄(確認中)指定解除に関するお知らせ,Notice regarding compliance with listing maintenance standards and cancellation of designation of stock under supervision (currently being confirmed) for our stock,東,TSE,https://www.release.tdnet.info/inbs/140120260415504921.pdf
17:00,326A0,Ｐ－エアロラボ,P-Aero Lab,通期連結業績予想の修正(下方修正)に関するお知らせ,Notice regarding revision (downward revision) of full-year consolidated performance forecast,東,TSE,https://www.release.tdnet.info/inbs/140120260415504932.pdf
17:00,31950,Ｇ－ジェネパ,G-Genepa,東京証券取引所スタンダード市場への市場区分変更申請に関するお知らせ,Notice regarding application for market classification change to Tokyo Stock Exchange Standard Market,東,TSE,https://www.release.tdnet.info/inbs/140120260415504939.pdf
17:00,28140,佐藤食品,sato food,上場維持基準への適合及び当社株式の監理銘柄（確認中）指定解除に関するお知らせ,Notice regarding compliance with listing maintenance standards and cancellation of designation of stock under supervision (currently being confirmed) for our stock,東,TSE,https://www.release.tdnet.info/inbs/140120260415504892.pdf
17:00,226A0,Ｐ－勝美ジャパン,P-Katsumi Japan,（変更）「子会社の設立に関するお知らせ」の一部変更について,(Change) Regarding partial changes to “Notice regarding establishment of subsidiary”,東,TSE,https://www.release.tdnet.info/inbs/140120260414504115.pdf
17:05,72550,桜井製作,Sakurai production,当社株式の上場廃止の決定及び整理銘柄の指定に関するお知らせ,Notice Regarding Decision on Delisting and Designation as Delisting Issue,東,TSE,https://www.release.tdnet.info/inbs/140120260415504936.pdf
17:30,49230,ＣＯＴＡ,COTA,サイバー攻撃によるシステム障害発生のお知らせ（第３報）,Notice of system failure due to cyber attack (3rd report),東,TSE,https://www.release.tdnet.info/inbs/140120260415505003.pdf
17:35,45980,Ｇ－ＤＥＬＴＡ－Ｐ,G-DELTA-P,DFP-17729の臨床第2/3相比較試験の進捗状況に関するお知らせ,Notice regarding the progress of the clinical phase 2/3 comparative study of DFP-17729,東,TSE,https://www.release.tdnet.info/inbs/140120260415504991.pdf
17:40,90730,京極運輸,Kyogoku Transport,上場維持基準への適合および当社株式の監理銘柄(確認中)指定解除に関するお知らせ,Notice regarding compliance with listing maintenance standards and cancellation of designation of stock under supervision (currently being confirmed) for our stock,東名,TSE / NSE,https://www.release.tdnet.info/inbs/140120260415505021.pdf
17:40,433A0,Ｐ－ＭＪＥ,P-MJE,通期業績予想の修正に関するお知らせ,Notice regarding revisions to full-year performance forecasts,東,TSE,https://www.release.tdnet.info/inbs/140120260415505013.pdf
