時刻,コード,会社名,会社名_en,表題,表題_en,市場,市場_en,PDF
17:00,29720,Ｒ－サンケイＲＥ,R-Sankei RE,2026年２月期の運用状況及び分配金の予想の修正（無配）及び減損損失の計上に関するお知らせ,Notice regarding management status and revision of dividend forecast (no dividend) and recording of impairment loss for the fiscal year ending February 2026,東,TSE,https://www.release.tdnet.info/inbs/140120260413502962.pdf
17:30,81070,キムラタン,Kimuratan,(訂正)「(開示事項の中止)「不動産の売却に関するお知らせ」の中止に関するお知らせ」の一部訂正について,"(Correction) Regarding partial corrections to ""(Cancelation of disclosure matters) Notice regarding discontinuation of 'Notice regarding sale of real estate'""",東,TSE,https://www.release.tdnet.info/inbs/140120260413502979.pdf
17:30,37760,ＢＢタワー,BB tower,主要株主である筆頭株主の異動に関するお知らせ,Notice regarding change in the largest and major shareholder,東,TSE,https://www.release.tdnet.info/inbs/140120260413502967.pdf
18:00,23030,ドーン,dawn,株式分割及び定款の一部変更に関するお知らせ,Notice regarding stock split and partial changes to the articles of incorporation,東,TSE,https://www.release.tdnet.info/inbs/140120260413502198.pdf
18:15,33230,レカム,Recum,子会社の年次決算情報に関するお知らせ,Notice regarding subsidiary's annual financial results information,東,TSE,https://www.release.tdnet.info/inbs/140120260413502857.pdf
18:30,58210,平河ヒューテ,Hirakawa Huete,株式無償割当てによる１株に満たない端数の処理に伴う自己株式の買取りに関するお知らせ,Notice regarding purchase of treasury stock due to processing of fractions less than 1 share due to free allotment of shares,東,TSE,https://www.release.tdnet.info/inbs/140120260413502395.pdf
15:30,75160,コーナン商,konan commercial,2026年２月期 決算短信〔日本基準〕（連結）,Earnings Report (Consolidated) for FY2026 ending February,東,TSE,https://www.release.tdnet.info/inbs/140120260413502455.pdf
15:30,73700,Ｇ－Ｅｎｊｉｎ,G-Enjin,2026年5月期 月次売上（3月度）のお知らせ,Monthly Report for May 2026,東,TSE,https://www.release.tdnet.info/inbs/140120260411501806.pdf
15:30,73700,Ｇ－Ｅｎｊｉｎ,G-Enjin,自己株式の取得状況に関するお知らせ,Notice Regarding Status of Share Buyback,東,TSE,https://www.release.tdnet.info/inbs/140120260411501803.pdf
15:30,73700,Ｇ－Ｅｎｊｉｎ,G-Enjin,業績予想の修正に関するお知らせ,Notice Regarding Revision of Earnings Forecast,東,TSE,https://www.release.tdnet.info/inbs/140120260411501807.pdf
15:30,73700,Ｇ－Ｅｎｊｉｎ,G-Enjin,2026年５月期 第３四半期決算説明資料,Earnings Presentation Materials for FY2026 ending May,東,TSE,https://www.release.tdnet.info/inbs/140120260412502181.pdf
15:30,73700,Ｇ－Ｅｎｊｉｎ,G-Enjin,2026年５月期 第３四半期決算短信〔日本基準〕(連結),Q3 Earnings Report (Consolidated) for FY2026 ending May,東,TSE,https://www.release.tdnet.info/inbs/140120260411501808.pdf
15:30,70850,カーブスＨＤ,Curves HD,2026年８月期第２四半期（中間期）決算短信〔日本基準〕(連結),Summary of financial results for the second quarter (interim period) of the fiscal year ending August 2026 [Japanese GAAP] (consolidated),東,TSE,https://www.release.tdnet.info/inbs/140120260413502403.pdf
15:30,70850,カーブスＨＤ,Curves HD,2026年８月期第２四半期（中間期）決算補足説明資料,Supplementary Earnings Materials for FY2026 ending August,東,TSE,https://www.release.tdnet.info/inbs/140120260413502396.pdf
15:30,70850,カーブスＨＤ,Curves HD,通期業績予想の修正（上方修正）及び配当予想の修正（記念配当増配）に関するお知らせ,Notice regarding revisions to full-year performance forecasts (upward revisions) and dividend forecasts (commemorative dividend increase),東,TSE,https://www.release.tdnet.info/inbs/140120260413502360.pdf
15:30,70850,カーブスＨＤ,Curves HD,株主優待制度の変更（拡充）及びチェーン創設20 周年記念特別優待実施に関するお知らせ,Notice regarding changes (expansion) to the shareholder benefit system and special benefits commemorating the chain's 20th anniversary,東,TSE,https://www.release.tdnet.info/inbs/140120260413502355.pdf
15:30,70850,カーブスＨＤ,Curves HD,新株予約権（有償ストック・オプション及び税制適格ストック・オプション）の発行に関するお知らせ,Notice Regarding Stock Acquisition Rights,東,TSE,https://www.release.tdnet.info/inbs/140120260413502344.pdf
15:30,70850,カーブスＨＤ,Curves HD,連結子会社からの配当金受領に関するお知らせ,Notice regarding receipt of dividends from consolidated subsidiaries,東,TSE,https://www.release.tdnet.info/inbs/140120260413502338.pdf
15:30,68380,多摩川ＨＤ,Tamagawa HD,第三者割当により発行された第16回新株予約権（行使価額修正選択権付）の大量行使に関するお知らせ,Notice Regarding Stock Acquisition Rights,東,TSE,https://www.release.tdnet.info/inbs/140120260413502754.pdf
15:30,68350,アライドＨＤ,Allied HD,自己株式の取得状況および取得終了に関するお知らせ,Notice Regarding Share Buyback Status and Completion,東,TSE,https://www.release.tdnet.info/inbs/140120260413502597.pdf
15:30,66340,ＪＮグループ,JN Group,営業外費用の計上に関するお知らせ,Notice Regarding Recording of Non-Operating Expenses,東,TSE,https://www.release.tdnet.info/inbs/140120260410502005.pdf
15:30,66340,ＪＮグループ,JN Group,2026年11月期第１四半期決算短信〔日本基準〕(連結),Q1 Earnings Report (Consolidated) for FY2026 ending November,東,TSE,https://www.release.tdnet.info/inbs/140120260410502000.pdf
15:30,65050,東洋電,Toyoden,2026年５月期 第３四半期決算短信〔日本基準〕(連結),Q3 Earnings Report (Consolidated) for FY2026 ending May,東,TSE,https://www.release.tdnet.info/inbs/140120260413502423.pdf
15:30,62660,タツモ,Tatsumo,譲渡制限付株式報酬としての自己株式の処分に関するお知らせ,Notice regarding disposal of treasury stock as restricted stock compensation,東,TSE,https://www.release.tdnet.info/inbs/140120260413502331.pdf
15:30,61820,Ｇ－メタリアル,G-Metalial,（開示事項の経過）連結子会社である株式会社ロゼッタにおける重要な新機能開発に関するお知らせ-エージェンティックAI搭載により、ほぼ完全自動翻訳を実現-,"(Progress Disclosure) Announcement regarding the development of important new functions at Rosetta Co., Ltd., a consolidated subsidiary - Equipped with agentic AI to achieve almost completely automatic translation -",東,TSE,https://www.release.tdnet.info/inbs/140120260413502648.pdf
15:30,59670,ＴＯＮＥ,TONE,2026年５月期 第３四半期決算短信〔日本基準〕（連結）,Q3 Earnings Report (Consolidated) for FY2026 ending May,東,TSE,https://www.release.tdnet.info/inbs/140120260413502334.pdf
15:30,547A0,ムニノバＨＤ,Muninova HD,臨時株主総会招集のための基準日設定に関するお知らせ,Notice regarding setting of record date for convening extraordinary general meeting of shareholders,東,TSE,https://www.release.tdnet.info/inbs/140120260409501161.pdf
15:30,542A0,Ｇ－ビタブリッドＪ,G-Vitabrid J,2026年2月期 決算説明資料,Earnings Presentation Materials for FY2026 ending February,東,TSE,https://www.release.tdnet.info/inbs/140120260412502164.pdf
15:30,542A0,Ｇ－ビタブリッドＪ,G-Vitabrid J,2026年2月期決算短信〔日本基準〕（非連結）,Earnings Report (Consolidated) for FY2026 ending February,東,TSE,https://www.release.tdnet.info/inbs/140120260409500999.pdf
15:30,50340,Ｇ－ｕｎｅｒｒｙ,G-unerry,本社移転及び定款一部変更に関するお知らせ,Notice regarding relocation of head office and partial amendment to articles of incorporation,東,TSE,https://www.release.tdnet.info/inbs/140120260413502385.pdf
15:30,463A0,インテリックスＨＤ,intellix hd,2026年5月期 第3四半期 決算説明資料,Earnings Presentation Materials for FY2026 ending May,東,TSE,https://www.release.tdnet.info/inbs/140120260410502043.pdf
15:30,463A0,インテリックスＨＤ,intellix hd,2026年５月期 第３四半期決算短信〔日本基準〕（連結）,Q3 Earnings Report (Consolidated) for FY2026 ending May,東,TSE,https://www.release.tdnet.info/inbs/140120260410501986.pdf
15:30,45300,久光薬,Hisako medicine,役員人事,Officer personnel,東名福,東名福,https://www.release.tdnet.info/inbs/140120260410502118.pdf
15:30,45300,久光薬,Hisako medicine,2026年２月期　決算短信〔日本基準〕（連結）,Earnings Report (Consolidated) for FY2026 ending February,東名福,東名福,https://www.release.tdnet.info/inbs/140120260410502121.pdf
15:30,446A0,Ｇ－ノースサンド,G-North Sand,AIの進化に関する当社の見解,Our view on the evolution of AI,東,TSE,https://www.release.tdnet.info/inbs/140120260413502726.pdf
15:30,44490,ギフティ,Gifty,現下の中東情勢による当社の事業及び業績への影響に関するお知らせ,Notice regarding the impact of the current situation in the Middle East on our business and performance,東,TSE,https://www.release.tdnet.info/inbs/140120260413502762.pdf
15:30,44340,サーバーワークス,server works,中東情勢の緊迫化に伴う当社グループへの影響のお知らせ,Notice regarding the impact on our group due to the increasingly tense situation in the Middle East,東,TSE,https://www.release.tdnet.info/inbs/140120260413502357.pdf
15:30,43970,Ｇ－チームスピリット,G-Team Spirit,2026年８月期 第２四半期決算説明資料,Earnings Presentation Materials for FY2026 ending August,東,TSE,https://www.release.tdnet.info/inbs/140120260410501924.pdf
15:30,43970,Ｇ－チームスピリット,G-Team Spirit,2026年８月期 第２四半期（中間期）決算短信〔日本基準〕（連結）,Summary of financial results for the second quarter (interim period) of the fiscal year ending August 2026 [Japanese GAAP] (consolidated),東,TSE,https://www.release.tdnet.info/inbs/140120260410501801.pdf
15:30,42060,アイカ工,Aikako,（開示事項の経過）インドStylam Industries Limitedへの公開買付け実施に向けた進捗状況のお知らせ,(Progress Disclosure) Announcement of progress towards implementation of tender offer for Stylam Industries Limited in India,東名,TSE / NSE,https://www.release.tdnet.info/inbs/140120260413502738.pdf
15:30,41760,Ｇ－ココナラ,G-Coco oak,2026年8月期第2四半期決算説明資料,Earnings Presentation Materials for FY2026 ending August,東,TSE,https://www.release.tdnet.info/inbs/140120260413502714.pdf
15:30,41760,Ｇ－ココナラ,G-Coco oak,2026年８月期 第２四半期（中間期）決算短信〔日本基準〕（連結）,Summary of financial results for the second quarter (interim period) of the fiscal year ending August 2026 [Japanese GAAP] (consolidated),東,TSE,https://www.release.tdnet.info/inbs/140120260413502677.pdf
15:30,41670,Ｇ－ココペリ,G-Kokopelli,ククレブ・アドバイザーズ株式会社との業務提携に関するお知らせ,"Announcement regarding business alliance with Kukurebu Advisors Co., Ltd.",東,TSE,https://www.release.tdnet.info/inbs/140120260413502185.pdf
15:30,40170,Ｇ－クリーマ,G-creamer,資本準備金の額の減少及び剰余金の処分に関するお知らせ,Notice regarding decrease in capital reserves and disposal of surplus,東,TSE,https://www.release.tdnet.info/inbs/140120260410502074.pdf
15:30,40170,Ｇ－クリーマ,G-creamer,会計監査人の異動に関するお知らせ,Notice regarding change of accounting auditor,東,TSE,https://www.release.tdnet.info/inbs/140120260410502073.pdf
15:30,39960,サインポスト,sign post,2026年2月期通期業績予想と実績値との差異に関するお知らせ,Notice regarding the difference between the full-year performance forecast and actual results for the fiscal year ending February 2026,東,TSE,https://www.release.tdnet.info/inbs/140120260410502044.pdf
15:30,39960,サインポスト,sign post,2026年2月期 決算短信〔日本基準〕(非連結),Earnings Report (Consolidated) for FY2026 ending February,東,TSE,https://www.release.tdnet.info/inbs/140120260410502042.pdf
15:30,39220,ＰＲＴＩＭＥＳ,PRTIMES,Milestone 2030 中期経営目標説明資料,Milestone 2030 medium-term management target explanatory material,東名,TSE / NSE,https://www.release.tdnet.info/inbs/140120260413502822.pdf
15:30,39220,ＰＲＴＩＭＥＳ,PRTIMES,2025年度 通期決算説明資料,Earnings Presentation Materials for FY2025,東名,TSE / NSE,https://www.release.tdnet.info/inbs/140120260413502808.pdf
15:30,39220,ＰＲＴＩＭＥＳ,PRTIMES,配当予想の修正（増配）に関するお知らせ,Notice regarding revision of dividend forecast (dividend increase),東名,TSE / NSE,https://www.release.tdnet.info/inbs/140120260410502126.pdf
15:30,39220,ＰＲＴＩＭＥＳ,PRTIMES,2026年２月期 決算短信〔日本基準〕（連結）,Earnings Report (Consolidated) for FY2026 ending February,東名,TSE / NSE,https://www.release.tdnet.info/inbs/140120260410502124.pdf
15:30,37600,ケイブ,cave,第三者割当による新株式発行に関するお知らせ,Notice Regarding Issuance of New Shares through Third-Party Allotment,東,TSE,https://www.release.tdnet.info/inbs/140120260409500980.pdf
15:30,37600,ケイブ,cave,通期業績予想の公表及び配当予想の修正（無配）に関するお知らせ,Announcement of full-year earnings forecast and revision of dividend forecast (no dividend),東,TSE,https://www.release.tdnet.info/inbs/140120260409500971.pdf
15:30,37600,ケイブ,cave,特別損失（事業撤退損）の計上及び営業外収益（保険解約返戻金）の発生に関するお知らせ,Notice regarding recording of extraordinary loss (loss on business withdrawal) and generation of non-operating income (insurance surrender value),東,TSE,https://www.release.tdnet.info/inbs/140120260409500969.pdf
15:30,37600,ケイブ,cave,株主優待制度の一部変更に関するお知らせ,Notice regarding partial changes to shareholder benefit system,東,TSE,https://www.release.tdnet.info/inbs/140120260409500967.pdf
15:30,37600,ケイブ,cave,2026年５月期第３四半期決算短信〔日本基準〕(連結),Q3 Earnings Report (Consolidated) for FY2026 ending May,東,TSE,https://www.release.tdnet.info/inbs/140120260408500202.pdf
15:30,36780,メディアドゥ,media do,取締役候補者、監査役候補者の選任及び執行体制に関するお知らせ,Notice regarding the selection of director candidates and auditor candidates and the executive structure,東,TSE,https://www.release.tdnet.info/inbs/140120260410501445.pdf
15:30,36780,メディアドゥ,media do,2026年２月期 決算短信〔日本基準〕（連結）,Earnings Report (Consolidated) for FY2026 ending February,東,TSE,https://www.release.tdnet.info/inbs/140120260410501433.pdf
15:30,36230,Ｇ－ＢＳ,G-BS,譲渡制限付株式報酬としての自己株式処分の払込完了に関するお知らせ,Notice regarding completion of payment for disposal of treasury stock as restricted stock compensation,東,TSE,https://www.release.tdnet.info/inbs/140120260413502350.pdf
15:30,36120,ワールド,world,上場廃止となった子会社（株式会社ライトオン）に関する決算開示について,"Regarding disclosure of financial statements regarding the delisted subsidiary (Righton Co., Ltd.)",東,TSE,https://www.release.tdnet.info/inbs/140120260413502422.pdf
15:30,35620,Ｎｏ．１,No.1,連結子会社からの配当金受領に関するお知らせ,Notice regarding receipt of dividends from consolidated subsidiaries,東,TSE,https://www.release.tdnet.info/inbs/140120260409501058.pdf
15:30,35620,Ｎｏ．１,No.1,剰余金の配当に関するお知らせ,Notice Regarding Dividend,東,TSE,https://www.release.tdnet.info/inbs/140120260409501057.pdf
15:30,35620,Ｎｏ．１,No.1,2026年２月期　決算説明資料,Earnings Presentation Materials for FY2026 ending February,東,TSE,https://www.release.tdnet.info/inbs/140120260409501105.pdf
15:30,35620,Ｎｏ．１,No.1,2026年２月期連結業績予想値と実績値との差異に関するお知らせ,Notice regarding the difference between the consolidated performance forecast and actual results for the fiscal year ending February 2026,東,TSE,https://www.release.tdnet.info/inbs/140120260410501836.pdf
15:30,35620,Ｎｏ．１,No.1,2026年２月期　決算短信〔日本基準〕（連結）,Earnings Report (Consolidated) for FY2026 ending February,東,TSE,https://www.release.tdnet.info/inbs/140120260409501103.pdf
15:30,340A0,Ｇ－ジグザグ,G-zigzag,2026年５月期第３四半期決算説明資料文字おこし,Earnings Presentation Materials for FY2026 ending May,東,TSE,https://www.release.tdnet.info/inbs/140120260413502747.pdf
15:30,340A0,Ｇ－ジグザグ,G-zigzag,2026年５月期第３四半期決算説明資料,Earnings Presentation Materials for FY2026 ending May,東,TSE,https://www.release.tdnet.info/inbs/140120260413502692.pdf
15:30,340A0,Ｇ－ジグザグ,G-zigzag,2026年５月期 第３四半期決算短信〔日本基準〕（非連結）,Q3 Earnings Report (Consolidated) for FY2026 ending May,東,TSE,https://www.release.tdnet.info/inbs/140120260413502681.pdf
15:30,33500,メタプラネット,Metaplanet,MPJPY（スポンサー付きレベル１ADR（米国預託証券）プログラム）に係る 発行手数料無料期間の設定に関するお知らせ,Notice regarding establishment of issuance fee free period regarding MPJPY (Sponsored Level 1 ADR (American Depositary Receipt) Program),東,TSE,https://www.release.tdnet.info/inbs/140120260413502656.pdf
15:30,33490,コスモス薬品,cosmos medicine,2026年５月期　第３四半期決算短信〔日本基準〕（連結）,Q3 Earnings Report (Consolidated) for FY2026 ending May,東,TSE,https://www.release.tdnet.info/inbs/140120260217563822.pdf
15:30,32810,Ｒ－ＧＬＰ,R-GLP,2026 年2 月期 決算短信（ＲＥＩＴ）,Summary of financial results for the fiscal year ending February 2026 (REIT),東,TSE,https://www.release.tdnet.info/inbs/140120260413502567.pdf
15:30,32810,Ｒ－ＧＬＰ,R-GLP,2026年2月期（第28期） 決算説明資料,Earnings Presentation Materials for FY2026 ending February,東,TSE,https://www.release.tdnet.info/inbs/140120260413502563.pdf
15:30,32810,Ｒ－ＧＬＰ,R-GLP,自己投資口取得及び消却に係る事項の決定に関するお知らせ,Notice regarding decisions regarding acquisition and cancellation of own investment units,東,TSE,https://www.release.tdnet.info/inbs/140120260413502560.pdf
15:30,32810,Ｒ－ＧＬＰ,R-GLP,規約一部変更及び役員選任に関するお知らせ,Notice regarding partial changes to regulations and appointment of officers,東,TSE,https://www.release.tdnet.info/inbs/140120260413502555.pdf
15:30,32810,Ｒ－ＧＬＰ,R-GLP,分配金の除斥期間経過に関するお知らせ,Notice regarding the expiration of the exclusion period for distributions,東,TSE,https://www.release.tdnet.info/inbs/140120260413502537.pdf
15:30,32360,プロパスト,Propast,連結決算への移行に伴う連結業績予想の公表及び個別業績予想の修正（取り下げ）に関するお知らせ,Notice regarding announcement of consolidated performance forecast and revision (withdrawal) of individual performance forecast due to transition to consolidated financial results,東,TSE,https://www.release.tdnet.info/inbs/140120260413502662.pdf
15:30,32360,プロパスト,Propast,2026年5月期第3四半期決算短信〔日本基準〕（連結）,Q3 Earnings Report (Consolidated) for FY2026 ending May,東,TSE,https://www.release.tdnet.info/inbs/140120260407599424.pdf
15:30,31900,ホットマン,hot man,監査役辞任および監査役候補者選任に関するお知らせ,Notice regarding resignation of Audit & Supervisory Board Member and selection of Audit & Supervisory Board Member candidates,東,TSE,https://www.release.tdnet.info/inbs/140120260413502504.pdf
15:30,31680,ＭＥＲＦ,MERF,2026年8月期第2四半期（中間期）決算短信〔日本基準〕（連結）,Summary of financial results for the second quarter (interim period) of the fiscal year ending August 2026 [Japanese GAAP] (consolidated),東,TSE,https://www.release.tdnet.info/inbs/140120260410501493.pdf
15:30,31600,大光,Great light,月次売上高及び前年比についてのお知らせ,Notice regarding monthly sales and year-on-year comparison,東,TSE,https://www.release.tdnet.info/inbs/140120260413502384.pdf
15:30,31110,オーミケンシ,Omi Kenshi,（開示事項の経過）サイバー攻撃によるシステム障害についてのお知らせ,(Progress Disclosure) Notice regarding system failure due to cyber attack,東,TSE,https://www.release.tdnet.info/inbs/140120260413502702.pdf
15:30,31110,オーミケンシ,Omi Kenshi,2026年3月期決算発表の延期に関するお知らせ,Notice regarding postponement of announcement of financial results for the fiscal year ending March 2026,東,TSE,https://www.release.tdnet.info/inbs/140120260413502669.pdf
15:30,30750,銚子丸,Choshimaru,2026年２月期　決算短信［日本基準］（非連結）,Earnings Report (Consolidated) for FY2026 ending February,東,TSE,https://www.release.tdnet.info/inbs/140120260413502577.pdf
15:30,30300,ハブ,hub,通期業績予想と実績値との差異及び配当予想の修正（特別配当）に関するお知らせ,Notice regarding the difference between the full-year performance forecast and actual results and the revision of the dividend forecast (special dividend),東,TSE,https://www.release.tdnet.info/inbs/140120260413502397.pdf
15:30,30300,ハブ,hub,2026年２月期決算補足説明資料,Supplementary Earnings Materials for FY2026 ending February,東,TSE,https://www.release.tdnet.info/inbs/140120260413502430.pdf
15:30,30300,ハブ,hub,2026年２月期決算短信〔日本基準〕（非連結）,Earnings Report (Consolidated) for FY2026 ending February,東,TSE,https://www.release.tdnet.info/inbs/140120260413502369.pdf
15:30,27890,カルラ,Carla,監査役の辞任及び補欠監査役の監査役就任に関するお知らせ,Notice regarding the resignation of a corporate auditor and the appointment of a substitute corporate auditor as a corporate auditor,東,TSE,https://www.release.tdnet.info/inbs/140120260413502190.pdf
15:30,276A0,Ｇ－ククレブ,G-Kukulev,株式会社ココペリとの業務提携に関するお知らせ,"Notice regarding business alliance with Kokopelli Co., Ltd.",東,TSE,https://www.release.tdnet.info/inbs/140120260410501550.pdf
15:30,276A0,Ｇ－ククレブ,G-Kukulev,販売用不動産の売却に関するお知らせ,Notice Regarding Sale of Real Estate for Sale,東,TSE,https://www.release.tdnet.info/inbs/140120260410501540.pdf
15:30,276A0,Ｇ－ククレブ,G-Kukulev,2026年8月期第2四半期　決算説明資料,Earnings Presentation Materials for FY2026 ending August,東,TSE,https://www.release.tdnet.info/inbs/140120260410501512.pdf
15:30,276A0,Ｇ－ククレブ,G-Kukulev,業績予想の上方修正に関するお知らせ,Notice regarding upward revision of performance forecasts,東,TSE,https://www.release.tdnet.info/inbs/140120260410501524.pdf
15:30,276A0,Ｇ－ククレブ,G-Kukulev,2026年8月期第2四半期（中間期）決算短信〔日本基準〕(連結),Summary of financial results for the second quarter (interim period) of the fiscal year ending August 2026 [Japanese GAAP] (consolidated),東,TSE,https://www.release.tdnet.info/inbs/140120260410501502.pdf
15:30,26560,ベクターＨＤ,vector hd,通期連結業績予想の修正並びに営業外費用及び特別損益の計上に関するお知らせ,Notice regarding revision of full-year consolidated performance forecast and recording of non-operating expenses and extraordinary profit and loss,東,TSE,https://www.release.tdnet.info/inbs/140120260413502370.pdf
15:30,24970,Ｇ－ＵＮＩＴＥＤ,G-UNITED,連結子会社の異動（株式譲渡による持分法適用関連会社への異動）に関するお知らせ,Notice regarding change of consolidated subsidiary (change to equity method affiliate due to stock transfer),東,TSE,https://www.release.tdnet.info/inbs/140120260413502573.pdf
15:30,24850,ティア,Tia,会社分割（吸収分割）による子会社への事業承継に関する,Concerning business succession to subsidiaries due to company split (absorption-type split),東名,TSE / NSE,https://www.release.tdnet.info/inbs/140120260413502592.pdf
15:30,24620,ライク,like,株主優待制度の変更に関するお知らせ,Notice regarding changes to shareholder benefit system,東,TSE,https://www.release.tdnet.info/inbs/140120260411501811.pdf
15:30,24620,ライク,like,2026年５月期 第３四半期決算短信〔日本基準〕（連結）,Q3 Earnings Report (Consolidated) for FY2026 ending May,東,TSE,https://www.release.tdnet.info/inbs/140120260411501810.pdf
15:30,24370,シンワワイズ,Shinwa Wise,株主優待制度の変更に関するお知らせ,Notice regarding changes to shareholder benefit system,東,TSE,https://www.release.tdnet.info/inbs/140120260413502539.pdf
