時刻,コード,会社名,会社名_en,表題,表題_en,市場,市場_en,PDF
17:40,20880,ＮＺＡＭ　ＤｏｗＨ,NZAM DowH,ETFの収益分配のお知らせ,Notification of ETF profit distribution,東,TSE,https://www.release.tdnet.info/inbs/140120260415505018.pdf
17:40,20870,ＮＺＡＭ　ＮＱ１Ｈ,NZAM NQ1H,ETFの収益分配のお知らせ,Notification of ETF profit distribution,東,TSE,https://www.release.tdnet.info/inbs/140120260415505017.pdf
17:40,20860,ＮＺＡＭ　ＳＰ５Ｈ,NZAM SP5H,ETFの収益分配のお知らせ,Notification of ETF profit distribution,東,TSE,https://www.release.tdnet.info/inbs/140120260415505016.pdf
17:40,15950,ＮＺＡＭ　Ｊリート,NZAM J-REIT,ETFの収益分配のお知らせ,Notification of ETF profit distribution,東,TSE,https://www.release.tdnet.info/inbs/140120260415505015.pdf
18:00,42880,アズジェント,Asgent,上場維持基準への適合及び当社株式の監理銘柄(確認中)指定解除に関するお知らせ,Notice regarding compliance with listing maintenance standards and cancellation of designation of stock under supervision (currently being confirmed) for our stock,東,TSE,https://www.release.tdnet.info/inbs/140120260415504557.pdf
18:00,26670,イメージワン,image one,（訂正）「資本金及び資本準備金の額の減少並びに剰余金の処分に関するお知らせ」の一部訂正について,(Correction) Regarding partial corrections to “Notice regarding reduction in amount of capital stock and capital reserves and disposal of surplus”,東,TSE,https://www.release.tdnet.info/inbs/140120260415504931.pdf
18:00,14450,Ｐ－ひかりＨＤ,P-Hikari HD,2026年８月期 中間決算短信〔日本基準〕(連結),Summary of interim financial results for the fiscal year ending August 2026 [Japanese standards] (consolidated),東,TSE,https://www.release.tdnet.info/inbs/140120260415504765.pdf
18:30,70770,Ｇ－ＡＬｉＮＫ,G-ALiNK,(訂正)2026年２月期 決算短信〔日本基準〕(連結)の一部訂正について,(Correction) Earnings Report (Consolidated) for FY2026 ending February,東,TSE,https://www.release.tdnet.info/inbs/140120260415504985.pdf
18:30,70770,Ｇ－ＡＬｉＮＫ,G-ALiNK,（訂正）2026年2月期通期業績予想と実績値の差異及び特別損失の計上に関するお知らせ,(Correction) Notice regarding the difference between the full-year earnings forecast and actual results for the fiscal year ending February 2026 and the recording of extraordinary losses,東,TSE,https://www.release.tdnet.info/inbs/140120260415504652.pdf
18:30,70770,Ｇ－ＡＬｉＮＫ,G-ALiNK,（訂正）代表取締役の異動に関するお知らせ,(Correction) Notice Regarding Change of Representative Director,東,TSE,https://www.release.tdnet.info/inbs/140120260415504648.pdf
19:00,35480,バロック,baroque,（訂正）「中期経営計画」の一部訂正に関するお知らせ,(Correction) Notice regarding partial revisions to the “Medium-term Management Plan”,東,TSE,https://www.release.tdnet.info/inbs/140120260415505036.pdf
19:00,35480,バロック,baroque,（訂正）「2026 年２月期 通期 決算補足説明資料」の一部訂正に関するお知らせ,(Correction) Notice regarding partial corrections to “Supplementary Explanatory Materials for Full-Year Financial Results for the Fiscal Year Ending February 2026”,東,TSE,https://www.release.tdnet.info/inbs/140120260415505032.pdf
19:15,43720,Ｇ－ユミルリンク,G-Ymir Link,（訂正）「譲渡制限付株式報酬としての自己株式の処分に関するお知らせ」の一部訂正について,(Correction) Regarding partial corrections to “Notice regarding disposal of treasury stock as restricted stock compensation”,東,TSE,https://www.release.tdnet.info/inbs/140120260415504938.pdf
10:00,16714,Ｅ－シンプレクス,E-Simplex,上場ＥＴＦ(管理会社：シンプレクス・アセット・マネジメント)に関する日々の開示事項,Daily Disclosure Items Regarding Listed ETF,東,TSE,https://www.release.tdnet.info/inbs/140120260415504469.pdf
10:45,453A0,ｉＳ米債カバコ,iS U.S. Bond Kabako,ＥＴＦの収益分配金見込額のお知らせ,Notice Regarding Estimated Distribution Amount,東,TSE,https://www.release.tdnet.info/inbs/140120260415504545.pdf
10:45,452A0,ｉＳＳＰカバコ,iSSP Kabako,ＥＴＦの収益分配金見込額のお知らせ,Notice Regarding Estimated Distribution Amount,東,TSE,https://www.release.tdnet.info/inbs/140120260415504544.pdf
11:00,96020,東宝,Toho,自己株式立会外買付取引（ＴｏＳＴＮｅＴ－３）による自己株式の取得結果および取得終了に関するお知らせ,Notice regarding the results and completion of acquisition of treasury stock through off-auction treasury stock repurchase transaction (ToSTNeT-3),東福,TSE / FSE,https://www.release.tdnet.info/inbs/140120260414503869.pdf
11:30,40580,Ｇ－トヨクモ,G-Toyokumo,2026年3月度 月次売上速報に関するお知らせ,Monthly Report for March 2026,東,TSE,https://www.release.tdnet.info/inbs/140120260414504224.pdf
11:30,40580,Ｇ－トヨクモ,G-Toyokumo,譲渡制限付株式報酬としての自己株式の処分に関するお知らせ,Notice regarding disposal of treasury stock as restricted stock compensation,東,TSE,https://www.release.tdnet.info/inbs/140120260414504222.pdf
11:30,351A0,Ｐ－アクシスＩＴＰ,P-Axis ITP,自己株式立会外買付取引（ToSTNeT-3）による自己株式の取得結果に関するお知らせ,Notice regarding the results of acquiring treasury stock through off-auction treasury stock repurchase transaction (ToSTNeT-3),東,TSE,https://www.release.tdnet.info/inbs/140120260415504543.pdf
11:30,31980,ＳＦＰＨＤ,SFPHD,（訂正・数値データ訂正）「２０２６年２月期 決算短信〔日本基準〕（連結）」の一部訂正について,(Correction) Earnings Report (Consolidated) for FY2026 ending February,東,TSE,https://www.release.tdnet.info/inbs/140120260414504351.pdf
11:30,20704,Ｎ－三菱ＵＦＪ証ＨＤ,N-Mitsubishi UFJ Certificate HD,上場ETN（発行者：三菱UFJ証券ホールディングス株式会社）に関する日々の開示事項,Daily Disclosure Items Regarding Listed ETN,東,TSE,https://www.release.tdnet.info/inbs/140120260415504530.pdf
11:30,15574,Ｅ－ＳＳＧＡＴＣ,E-SSGATC,State Street SPDR S&P500 ETFに関する日々の開示事項,Daily Disclosure Items Regarding SPDR ETF,東,TSE,https://www.release.tdnet.info/inbs/140120260415504570.pdf
11:35,13494,Ｅ－ＳＳＧＡ－ＳＩＮ,E-SSGA-SIN,アジア国債・公債ＥＴＦ（正式名称：ＡＢＦ汎アジア債券インデックス・ファンド）に関する日々の開示事項,Daily Disclosure Items Regarding Asian Bond ETF,東,TSE,https://www.release.tdnet.info/inbs/140120260415504574.pdf
11:40,13264,Ｅ－ワールド,E-World,SPDRゴールド・シェアに関する日々の開示事項,Daily Disclosure Items Regarding SPDR ETF,東,TSE,https://www.release.tdnet.info/inbs/140120260415504577.pdf
12:00,62940,オカダアイヨン,Okada Aiyon,取締役の異動および役員人事に関するお知らせ,Notice regarding changes in directors and personnel changes to officers,東,TSE,https://www.release.tdnet.info/inbs/140120260415504623.pdf
12:30,48930,Ｇ－ノイルイミューン,G-Noil Immune,譲渡制限付株式報酬としての新株式発行に関するお知らせ,Notice regarding issuance of new shares as restricted stock compensation,東,TSE,https://www.release.tdnet.info/inbs/140120260415504682.pdf
12:30,36340,ソケッツ,sockets,スタンダード市場上場維持基準の適合に関する経過報告,Progress report regarding compliance with Standard Market Listing Maintenance Criteria,東,TSE,https://www.release.tdnet.info/inbs/140120260415504611.pdf
12:30,274A0,ガーデン,garden,（訂正）決算説明資料の一部訂正について,(Correction) Regarding some corrections to financial results briefing materials,東,TSE,https://www.release.tdnet.info/inbs/140120260415504610.pdf
13:00,40150,Ｇ－ペイクラウドＨＤ,G-Pay Cloud HD,自己株式の取得に係る事項の決定に関するお知らせ,Notice Regarding Decision on Share Buyback,東,TSE,https://www.release.tdnet.info/inbs/140120260415504569.pdf
14:00,80010,伊藤忠,Itochu,監査役の異動に関するお知らせ,Notice regarding changes in auditors,東,TSE,https://www.release.tdnet.info/inbs/140120260415504711.pdf
14:00,23000,きょくと,Kyokuto,2026年２月期通期業績予想値と実績の差異,Difference between full-year earnings forecast and actual results for the fiscal year ending February 2026,東,TSE,https://www.release.tdnet.info/inbs/140120260415504754.pdf
14:00,23000,きょくと,Kyokuto,2026年２月期決算短信〔日本基準〕（非連結）,Earnings Report (Consolidated) for FY2026 ending February,東,TSE,https://www.release.tdnet.info/inbs/140120260415504750.pdf
14:30,41160,大日精化,Dainichiseika,「当社株式の大規模買付行為に関する対応方針（買収への対応方針）」の継続に関するお知らせ,"Notice regarding the continuation of the ""Policy for Large-Scale Purchases of Company Shares (Policy for Acquisitions)""",東,TSE,https://www.release.tdnet.info/inbs/140120260415504434.pdf
14:30,29750,スター・マイカＨＤ,Star Mica HD,住宅設備の供給条件調整及び受注停止等の報道に係る当社業績への影響について,"Regarding the impact on the Company's business results of reports regarding adjustment of housing equipment supply conditions and suspension of orders, etc.",東,TSE,https://www.release.tdnet.info/inbs/140120260415504775.pdf
15:00,89040,ＡＶＡＮＴＩＡ,AVANTIA,2026年8月期 第2四半期決算説明会資料,Earnings Presentation Materials for FY2026 ending August,東名,TSE / NSE,https://www.release.tdnet.info/inbs/140120260415504511.pdf
15:00,87050,日産証券グループ,Nissan Securities Group,特別損失（固定資産の減損損失）の計上に関するお知らせ,Notice regarding recording of extraordinary loss (impairment loss on fixed assets),東,TSE,https://www.release.tdnet.info/inbs/140120260414504093.pdf
15:00,78470,グラファイトＤ,Graphite D,2026年２月期 決算短信〔日本基準〕（非連結）,Earnings Report (Consolidated) for FY2026 ending February,東,TSE,https://www.release.tdnet.info/inbs/140120260414503893.pdf
15:00,71830,あんしん保証,Safety guarantee,資金の借入に関するお知らせ,Notice Regarding Borrowing of Funds,東,TSE,https://www.release.tdnet.info/inbs/140120260415504638.pdf
15:00,65160,山洋電気,Sanyo Denki,指名委員会の設置に関するお知らせ,Notice Regarding Establishment of Nomination Committee,東,TSE,https://www.release.tdnet.info/inbs/140120260415504735.pdf
15:00,46590,エイジス,Aegis,2026年３月度売上高対前年同月比のお知らせ,Sales Report for March 2026,東,TSE,https://www.release.tdnet.info/inbs/140120260415504608.pdf
15:00,362A0,Ｐ－エクシオＨＤ,P-Exio HD,執行役員制度の導入に関するお知らせ,Notice regarding introduction of executive officer system,東,TSE,https://www.release.tdnet.info/inbs/140120260415504547.pdf
15:00,362A0,Ｐ－エクシオＨＤ,P-Exio HD,担当J-Adviserおよび流動性プロバイダーの異動に関するお知らせ,Notice regarding changes in J-Adviser and liquidity provider,東,TSE,https://www.release.tdnet.info/inbs/140120260415504517.pdf
15:00,24610,ファンコミ,fancomi,2026年12月期3月度 月次業績速報のお知らせ,Monthly Report for December 2026,東,TSE,https://www.release.tdnet.info/inbs/140120260413502830.pdf
15:00,23440,平安レイ,Heian Lei,株式併合及び定款の一部変更に係る承認決議に関するお知らせ,Notice regarding approval resolution regarding share consolidation and partial amendment to articles of incorporation,東,TSE,https://www.release.tdnet.info/inbs/140120260414503904.pdf
15:00,14520,Ｐ－横浜ライト工業,P-Yokohama Light Industry,法人税等調整額（損）の計上に関するお知らせ,Notice regarding recording of corporate tax adjustment (loss),東,TSE,https://www.release.tdnet.info/inbs/140120260414503685.pdf
15:00,14520,Ｐ－横浜ライト工業,P-Yokohama Light Industry,2026年２月期の個別業績の前期実績値との差異に関するお知らせ,Notice regarding the difference between individual results for the fiscal year ending February 2026 and the previous fiscal year's results,東,TSE,https://www.release.tdnet.info/inbs/140120260414503691.pdf
15:00,14520,Ｐ－横浜ライト工業,P-Yokohama Light Industry,2026年２月期 決算短信〔日本基準〕（連結）,Earnings Report (Consolidated) for FY2026 ending February,東,TSE,https://www.release.tdnet.info/inbs/140120260413503050.pdf
15:30,99970,ベルーナ,Belluna,3月度　月次売上高前年同月比（速報値）に関するお知らせ,Notice regarding March monthly sales compared to the same month last year (preliminary figures),東,TSE,https://www.release.tdnet.info/inbs/140120260415504815.pdf
15:30,92790,ギフトＨＤ,gift hd,株主優待制度のポイント化への変更及び 優待内容拡充に関するお知らせ,Announcement regarding changes to shareholder benefit system to point system and expansion of benefit content,東,TSE,https://www.release.tdnet.info/inbs/140120260415504523.pdf
15:30,92350,Ｇ－売れるネットＧ,G-Selling Net G,臨時株主総会の招集のための基準日設定及び臨時株主総会開催に関するお知らせ,Notice regarding setting of record date for convening an extraordinary general meeting of shareholders and holding of an extraordinary general meeting of shareholders,東,TSE,https://www.release.tdnet.info/inbs/140120260414504054.pdf
15:30,91660,Ｇ－ＧＥＮＤＡ,G-GENDA,GENDA売上進捗レポート発行に関するお知らせ【2026年４月】,Notice regarding publication of GENDA sales progress report [April 2026],東,TSE,https://www.release.tdnet.info/inbs/140120260415504685.pdf
15:30,90600,日ロジテム,Japan Logistics System,代表取締役の異動（社長交代）に関するお知らせ,Notice regarding change of representative director (replacement of president),東,TSE,https://www.release.tdnet.info/inbs/140120260415504421.pdf
15:30,89680,Ｒ－福岡,R-Fukuoka,規約一部変更及び役員選任に関するお知らせ,Notice regarding partial changes to regulations and appointment of officers,東福,TSE / FSE,https://www.release.tdnet.info/inbs/140120260415504752.pdf
15:30,89680,Ｒ－福岡,R-Fukuoka,福岡リート投資法人　第43期決算説明資料（2025年9月1日～2026年2月28日）,"Fukuoka REIT Investment Corporation 43rd period financial results briefing material (September 1, 2025 - February 28, 2026)",東福,TSE / FSE,https://www.release.tdnet.info/inbs/140120260415504749.pdf
15:30,89680,Ｒ－福岡,R-Fukuoka,2026年2月期　決算短信（ＲＥＩＴ）,Earnings Report for FY2026 ending February,東福,TSE / FSE,https://www.release.tdnet.info/inbs/140120260415504700.pdf
15:30,86130,丸三証,Maru Sansho,2026年3月期 決算速報値に関するお知らせ,Notice regarding preliminary financial results for the fiscal year ending March 2026,東,TSE,https://www.release.tdnet.info/inbs/140120260415504684.pdf
15:30,82670,イオン,ion,（開示事項の経過）株式会社ツルハホールディングス（証券コード3391）に対する公開買付け後の株式取得の完了に関するお知らせ,"(Progress Disclosure) Notice Regarding Completion of Share Acquisition after Tender Offer for Tsuruha Holdings Co., Ltd. (Securities Code 3391)",東,TSE,https://www.release.tdnet.info/inbs/140120260415504769.pdf
15:30,82540,さいか屋,Saikaya,（開示内容の変更）資本金および資本準備金の額の減少等の効力発生日の変更に関するお知らせ,"(Changes in disclosure content) Notice regarding changes in the effective date of reductions in capital stock and capital reserves, etc.",東,TSE,https://www.release.tdnet.info/inbs/140120260415504635.pdf
15:30,82420,Ｈ２Ｏリテイル,H2O Retail,投資有価証券の売却に伴う特別利益の計上額確定に関するお知らせ,Notice Regarding Determination of Recorded Amount of Extraordinary Gains Associated with Sale of Investment Securities,東,TSE,https://www.release.tdnet.info/inbs/140120260415504692.pdf
15:30,82330,高島屋,Takashimaya,2026年3月度 高島屋営業報告,Takashimaya business report for March 2026,東,TSE,https://www.release.tdnet.info/inbs/140120260410501974.pdf
15:30,80010,伊藤忠,Itochu,日立建機株式会社の追加持分取得完了に関するお知らせ,"Notice regarding completion of acquisition of additional equity in Hitachi Construction Machinery Co., Ltd.",東,TSE,https://www.release.tdnet.info/inbs/140120260415504713.pdf
15:30,78110,中本パックス,Nakamoto Pax,（訂正・数値データ訂正）「2026年２月期 決算短信〔日本基準〕（連結）」の一部訂正に関するお知らせ,(Correction) Earnings Report (Consolidated) for FY2026 ending February,東,TSE,https://www.release.tdnet.info/inbs/140120260415504588.pdf
15:30,76490,スギＨＤ,Sugi HD,スギホールディングス株式会社 2026年3月度 月次速報に関するお知らせ,Monthly Report for March 2026,東名,TSE / NSE,https://www.release.tdnet.info/inbs/140120260415504784.pdf
15:30,76040,梅の花グループ,plum blossom group,連結子会社からの配当金受領に関するお知らせ,Notice regarding receipt of dividends from consolidated subsidiaries,東,TSE,https://www.release.tdnet.info/inbs/140120260415504472.pdf
15:30,75150,マルヨシセンター,Maruyoshi Center,業績予想と実績値との差異に関するお知らせ,Notice regarding differences between performance forecasts and actual values,東,TSE,https://www.release.tdnet.info/inbs/140120260410502080.pdf
15:30,75150,マルヨシセンター,Maruyoshi Center,2026年2月期(2025年度) 決算補足資料,Supplementary Earnings Materials for FY2026 ending February,東,TSE,https://www.release.tdnet.info/inbs/140120260403598057.pdf
15:30,75150,マルヨシセンター,Maruyoshi Center,2026年2月期決算短信〔日本基準〕（連結）,Earnings Report (Consolidated) for FY2026 ending February,東,TSE,https://www.release.tdnet.info/inbs/140120260403597984.pdf
15:30,73170,Ｇ－松屋Ｒ＆Ｄ,G-Matsuya R&D,受取配当金に関する営業外収益の計上に関するお知らせ,Notice regarding recording of non-operating income regarding dividends received,東,TSE,https://www.release.tdnet.info/inbs/140120260414504329.pdf
15:30,70380,フロンティアＭ,Frontier M,譲渡制限付株式報酬としての新株発行に関するお知らせ,Notice regarding issuance of new shares as restricted stock compensation,東,TSE,https://www.release.tdnet.info/inbs/140120260415504772.pdf
15:30,69230,スタンレー電,stanley electric,（開示事項の変更）財務上の特約が付された金銭消費貸借契約の締結について,(Changes in disclosure matters) Concerning the conclusion of a monetary loan agreement with special financial provisions,東,TSE,https://www.release.tdnet.info/inbs/140120260415504748.pdf
15:30,68900,フェローテック,ferrotec,リストリクテッド・ストック・ユニット（RSU）としての自己株式処分に関するお知らせ,Notice regarding disposal of treasury stock as restricted stock units (RSU),東,TSE,https://www.release.tdnet.info/inbs/140120260415504575.pdf
15:30,68660,日置電,Hioki Electric,2026年12月期 第１四半期決算短信〔日本基準〕（連結）,Q1 Earnings Report (Consolidated) for FY2026 ending December,東,TSE,https://www.release.tdnet.info/inbs/140120260415504602.pdf
15:30,67210,ウインテスト,wintest,募集新株予約権（有償ストック・オプション）の発行に関するお知らせ,Notice Regarding Stock Acquisition Rights,東,TSE,https://www.release.tdnet.info/inbs/140120260414504340.pdf
15:30,66270,テラプローブ,terra probe,2026年12月期３度の月次連結売上高（速報）に関するお知らせ,Monthly Report for December 2026,東,TSE,https://www.release.tdnet.info/inbs/140120260415504464.pdf
15:30,62980,ワイエイシイＨＤ,YAC HD,株主提案権行使に係る書面の受領に関するお知らせ,Notice regarding receipt of documents regarding exercise of shareholder proposal rights,東,TSE,https://www.release.tdnet.info/inbs/140120260415504818.pdf
15:30,61670,冨士ダイス,fuji dice,代表取締役の異動（増員）及び取締役（監査等委員である取締役を除く。）候補者選任に関するお知らせ,Notice regarding change (increase in number) of representative directors and nomination of candidates for directors (excluding directors who are members of the Audit and Supervisory Committee),東,TSE,https://www.release.tdnet.info/inbs/140120260415504847.pdf
15:30,60780,バリューＨＲ,value HR,募集新株予約権（有償ストック・オプション）の発行内容確定に関するお知らせ,Notice Regarding Stock Acquisition Rights,東,TSE,https://www.release.tdnet.info/inbs/140120260415504776.pdf
15:30,60420,ニッキ,Nikki,役員人事に関するお知らせ,Notice Regarding Officer Personnel Changes,東,TSE,https://www.release.tdnet.info/inbs/140120260413502426.pdf
15:30,60270,弁護士ドットコム,lawyer.com,特別損失の計上に関するお知らせ,Notice regarding recording of extraordinary loss,東,TSE,https://www.release.tdnet.info/inbs/140120260415504708.pdf
15:30,60270,弁護士ドットコム,lawyer.com,資金の借入れに関するお知らせ,Notice regarding borrowing of funds,東,TSE,https://www.release.tdnet.info/inbs/140120260415504656.pdf
15:30,50740,テスホールディングス,Tess Holdings,子会社による財務上の特約が付された金銭消費貸借契約の締結に関するお知らせ,Notice regarding the conclusion of a financial loan agreement with special financial provisions by a subsidiary,東,TSE,https://www.release.tdnet.info/inbs/140120260415504702.pdf
15:30,50250,Ｇ－マーキュリー,G-Mercury,(訂正)「2026年２月期決算短信〔日本基準〕(非連結)」の一部訂正について,(Correction) Earnings Report (Consolidated) for FY2026 ending February,東,TSE,https://www.release.tdnet.info/inbs/140120260415504866.pdf
15:30,50130,ユシロ,Yushiro,定款一部変更に関するお知らせ,Notice Regarding Partial Amendment to Articles of Incorporation,東,TSE,https://www.release.tdnet.info/inbs/140120260414503191.pdf
15:30,49720,綜研化学,Soken Chemical,役員の異動に関するお知らせ,Notice Regarding Change of Officers,東,TSE,https://www.release.tdnet.info/inbs/140120260414503209.pdf
15:30,49110,資生堂,Shiseido,完全子会社（資生堂クリエイティブ株式会社）の吸収合併（簡易合併・略式合併）に関するお知らせ,"Notice regarding absorption-type merger (simple merger/informal merger) of wholly owned subsidiary (Shiseido Creative Co., Ltd.)",東,TSE,https://www.release.tdnet.info/inbs/140120260403598029.pdf
15:30,49110,資生堂,Shiseido,完全子会社（資生堂インタラクティブビューティー株式会社）の 吸収合併（簡易合併・略式合併）に関するお知らせ,"Notice regarding absorption-type merger (simple merger/informal merger) of wholly owned subsidiary (Shiseido Interactive Beauty Co., Ltd.)",東,TSE,https://www.release.tdnet.info/inbs/140120260403598022.pdf
15:30,48910,Ｇ－ティムス,G-Tims,ストック・オプションとしての新株予約権の発行に関するお知らせ,Notice Regarding Stock Acquisition Rights,東,TSE,https://www.release.tdnet.info/inbs/140120260414504243.pdf
15:30,48820,Ｇ－ペルセウス,G-Perseus,株式報酬型ストック・オプション（新株予約権）の発行に関するお知らせ,Notice Regarding Stock Acquisition Rights,東,TSE,https://www.release.tdnet.info/inbs/140120260413503019.pdf
15:30,45990,Ｇ－ステムリム,G-stem rim,再生誘導医薬レダセムチド（HMGB1ペプチド）における虚血性心筋症患者を対象とした第1/2相医師主導治験の患者組み入れ完了のお知らせ,Announcement of completion of patient enrollment in Phase 1/2 investigator-initiated clinical trial for patients with ischemic cardiomyopathy for the regeneration-inducing drug redasemtide (HMGB1 peptide),東,TSE,https://www.release.tdnet.info/inbs/140120260415504859.pdf
15:30,45680,第一三共,Daiichi Sankyo,第一三共ヘルスケアの株式譲渡（連結子会社の異動）に関するお知らせ,Notice regarding stock transfer (change in consolidated subsidiary) of Daiichi Sankyo Healthcare,東,TSE,https://www.release.tdnet.info/inbs/140120260325588981.pdf
15:30,43430,イオンファン,ion fan,2027年２月期　３月度の売上概況,Sales overview for February and March 2027,東,TSE,https://www.release.tdnet.info/inbs/140120260415504727.pdf
15:30,428A0,サイプレスＨＤ,Cypress Holdings,フランチャイズ事業開始に関するお知らせ,Notice regarding start of franchise business,東,TSE,https://www.release.tdnet.info/inbs/140120260415504828.pdf
15:30,42500,Ｑ－フロンティア,Q-Frontier,2026年11月期 第１四半期決算短信〔日本基準〕(連結),Q1 Earnings Report (Consolidated) for FY2026 ending November,福,FSE,https://www.release.tdnet.info/inbs/140120260415504741.pdf
15:30,401A0,Ｒ－霞ヶ関ホテル,R-Kasumigaseki Hotel,借入金の期限前弁済に関するお知らせ,Notice regarding early repayment of borrowings,東,TSE,https://www.release.tdnet.info/inbs/140120260415504764.pdf
